{
  "$schema": "../schema.json",
  "$comment": "Example resources. Not shown in the registries; used to preview entry.html (?src=example) and to test scripts/validate.py. Each card field explains what belongs in it.",
  "datasets": [
    {
      "id": "example-dataset",
      "title": "Example dataset entry",
      "summary": "A placeholder that shows how a released dataset is laid out, with every field of the dataset card filled.",
      "status": "released",
      "version": "1.0.0",
      "released": "2026-01-15",
      "authors": [
        "Author One",
        "Author Two"
      ],
      "tags": [
        "example",
        "census tracts",
        "2015–2024"
      ],
      "license": "CC BY 4.0",
      "access": "Open download. Source imagery is not redistributed; derived values only.",
      "links": [
        {
          "label": "Download",
          "href": "https://github.com/Hamsterradcc/urbanprobe.com"
        },
        {
          "label": "Resource standard",
          "href": "standards.html#datasets"
        }
      ],
      "citation": "Author One and Author Two (2026). Example dataset entry, version 1.0.0. UrbanProbe. https://urbanprobe.com/entry.html?registry=datasets&id=example-dataset",
      "card": {
        "geography_time": "Give the extent, the spatial unit or raster resolution, the coordinate reference system, the period covered, and how often the data is updated.",
        "variables_schema": "List every field with its type, unit, allowed values, and how missing values are coded.",
        "provenance": "Name each original provider, how the data was collected or obtained, the sampling, and the rights attached to each source.",
        "processing": "Describe cleaning, joining, aggregation, and derivation in order, and link the script that performs each step.",
        "validation": "Report completeness and consistency checks, comparison with reference data, and known error rates.",
        "limitations": "Describe coverage gaps, biases, mismatches in time between sources, and uses the dataset does not support."
      },
      "themes": [
        "climate",
        "health-equity",
        "sensing"
      ],
      "cities": [
        "Example City A",
        "Example City B"
      ],
      "spatial_unit": "Census tract",
      "period": "2015–2024",
      "formats": [
        "CSV",
        "GeoParquet"
      ],
      "doi": "10.5281/zenodo.0000001",
      "variables": [
        {
          "name": "tract_id",
          "type": "string",
          "description": "Census tract identifier."
        },
        {
          "name": "city",
          "type": "category",
          "description": "City the tract belongs to."
        },
        {
          "name": "year",
          "type": "integer",
          "description": "Observation year."
        },
        {
          "name": "canopy_pct",
          "type": "number",
          "unit": "%",
          "description": "Share of tract area under tree canopy."
        },
        {
          "name": "lst_c",
          "type": "number",
          "unit": "°C",
          "description": "Mean summer land-surface temperature."
        },
        {
          "name": "pop_density",
          "type": "number",
          "unit": "people/km²",
          "description": "Residents per square kilometre."
        }
      ],
      "preview": "data/examples/sample.csv",
      "distributions": [
        {
          "format": "CSV",
          "href": "data/examples/sample.csv",
          "label": "Sample (example rows)",
          "size": "2 KB"
        },
        {
          "format": "GeoParquet",
          "href": "https://github.com/Hamsterradcc/urbanprobe.com",
          "label": "Full release",
          "size": "48 MB"
        }
      ],
      "changelog": [
        {
          "version": "1.0.0",
          "date": "2026-01-15",
          "note": "First release."
        }
      ]
    },
    {
      "id": "example-dataset-streets",
      "title": "Example street segment dataset entry",
      "summary": "A second placeholder dataset at street-segment level, used to show filters.",
      "status": "released",
      "version": "0.3.0",
      "released": "2026-04-10",
      "authors": [
        "Author Three"
      ],
      "tags": [
        "example",
        "census tracts",
        "2015–2024"
      ],
      "license": "ODbL-1.0",
      "access": "Open download. Source imagery is not redistributed; derived values only.",
      "links": [
        {
          "label": "Download",
          "href": "https://github.com/Hamsterradcc/urbanprobe.com"
        },
        {
          "label": "Resource standard",
          "href": "standards.html#datasets"
        }
      ],
      "citation": "Author Three (2026). Example street segment dataset entry, version 0.3.0. UrbanProbe.",
      "card": {
        "geography_time": "Give the extent, the spatial unit or raster resolution, the coordinate reference system, the period covered, and how often the data is updated.",
        "variables_schema": "List every field with its type, unit, allowed values, and how missing values are coded.",
        "provenance": "Name each original provider, how the data was collected or obtained, the sampling, and the rights attached to each source.",
        "processing": "Describe cleaning, joining, aggregation, and derivation in order, and link the script that performs each step.",
        "validation": "Report completeness and consistency checks, comparison with reference data, and known error rates.",
        "limitations": "Describe coverage gaps, biases, mismatches in time between sources, and uses the dataset does not support."
      },
      "themes": [
        "mobility",
        "built-environment"
      ],
      "cities": [
        "Example City C"
      ],
      "spatial_unit": "Street segment",
      "period": "2023",
      "formats": [
        "GeoJSON"
      ],
      "changelog": [
        {
          "version": "0.3.0",
          "date": "2026-04-10",
          "note": "First public release."
        }
      ]
    }
  ],
  "indicators": [
    {
      "id": "example-indicator",
      "title": "Example indicator entry",
      "summary": "A placeholder that shows how a released indicator is laid out, from definition to sensitivity analysis.",
      "status": "released",
      "version": "2.0.0",
      "released": "2026-02-10",
      "authors": [
        "Author One"
      ],
      "tags": [
        "example",
        "street segment"
      ],
      "license": "CC BY 4.0 (values), MIT (code)",
      "links": [
        {
          "label": "Values",
          "href": "https://github.com/Hamsterradcc/urbanprobe.com"
        },
        {
          "label": "First version",
          "href": "entry.html?registry=indicators&id=example-indicator-v1&src=example"
        }
      ],
      "citation": "Author One (2026). Example indicator entry, version 2.0.0. UrbanProbe.",
      "card": {
        "definition": "Say what the indicator is meant to measure, the concept behind it, and why this way of measuring it was chosen.",
        "provenance": "List the datasets it is computed from, with their versions, and every parameter or threshold.",
        "processing": "Give the formula or algorithm step by step, and link the code that implements it.",
        "spatial_scale": "Name the unit the values are reported at, and explain how the indicator behaves when aggregated or split.",
        "geography_time": "Name the places and periods for which values are released.",
        "validation": "Report agreement with ground truth, surveys, or established measures.",
        "sensitivity": "Show how values change with parameter choices and input errors, and how uncertainty is reported.",
        "limitations": "Name contexts where the indicator is not valid, and interpretations it does not support."
      },
      "themes": [
        "climate",
        "health-equity"
      ],
      "cities": [
        "Example City A",
        "Example City B"
      ],
      "spatial_unit": "Census tract",
      "period": "2015–2024",
      "related": [
        {
          "registry": "datasets",
          "id": "example-dataset",
          "relation": "derived-from"
        },
        {
          "registry": "methods",
          "id": "example-method",
          "relation": "computed-by"
        }
      ],
      "changelog": [
        {
          "version": "1.0.0",
          "date": "2025-11-01",
          "note": "First release."
        },
        {
          "version": "2.0.0",
          "date": "2026-02-10",
          "note": "Switched to summer-mean temperature; values are not comparable with 1.x."
        }
      ]
    },
    {
      "id": "example-indicator-v1",
      "title": "Example indicator entry (first version)",
      "summary": "A placeholder for a deprecated resource, kept for the record and pointing to its replacement.",
      "status": "deprecated",
      "version": "1.0.0",
      "released": "2025-11-01",
      "replaced_by": "example-indicator",
      "themes": [
        "climate"
      ]
    }
  ],
  "methods": [
    {
      "id": "example-method",
      "title": "Example method entry",
      "summary": "A placeholder that shows how a released method is laid out, including its worked example and maintenance status.",
      "status": "released",
      "version": "0.4.1",
      "released": "2026-03-05",
      "updated": "2026-04-02",
      "authors": [
        "Author One",
        "Author Two"
      ],
      "tags": [
        "example",
        "python"
      ],
      "license": "MIT",
      "links": [
        {
          "label": "Repository",
          "href": "https://github.com/Hamsterradcc/urbanprobe.com"
        }
      ],
      "citation": "Author One and Author Two (2026). Example method entry, version 0.4.1. UrbanProbe.",
      "card": {
        "problem_users": "State the urban question the method answers and who is expected to run it.",